{
  "schema_version": "1.0",
  "child_contract_id": "STUDIO-009P-01",
  "provider_profile_id": "provider-profile:groq-free-gpt-oss-120b",
  "provider_profile_digest": "sha256:a2b53e4933d01da5ef3a1d58749975aec2e4efb0bc9839cd3d870a78a23f9d5b",
  "evidence_class": "SYNTHETIC",
  "owner_acceptance_ref": "owner-approval:studio-009p-01-contract",
  "provider_identity_evidence_ref": "evidence:groq-official-docs-2026-09-03",
  "transport_evidence_ref": "evidence:groq-transport-policy",
  "credential_profile_ref": "credential-profile:groq-api-key",
  "credential_evidence_ref": "evidence:credential-not-enrolled",
  "model_policy_evidence_ref": "evidence:groq-gpt-oss-120b-allowlist",
  "capability_evidence_ref": "evidence:groq-declared-capabilities",
  "data_export_evidence_ref": "evidence:groq-public-zdr-policy",
  "quota_evidence_ref": "evidence:groq-free-quota-snapshot",
  "budget_evidence_ref": "evidence:groq-zero-budget",
  "kill_switch_evidence_ref": "evidence:studio-owner-kill-switch",
  "incident_response_evidence_ref": "evidence:groq-incident-response",
  "rollback_evidence_ref": "evidence:manual-fake-rollback",
  "accepted_at": "2026-09-03T10:22:15Z",
  "expires_at": "2027-09-03T10:22:15Z",
  "revoked_at": null,
  "as_of": "2026-09-03T10:23:00Z",
  "canonical_digest": "sha256:8f5b6c679c7dfbec15d63f8d750bc9b404bb46cb99efe62ea47c2a16e543f98f"
}
