{
  "schema_version": "1.0",
  "child_contract_id": "STUDIO-009P-03",
  "provider_profile_id": "provider-profile:nvidia-nim-free-deepseek-v4-pro-0813",
  "provider_profile_digest": "sha256:4c7603b4feb67ae288e5d383a27c4cdf75eb79fc38d0ffe091e8870b05e6eb62",
  "evidence_class": "SYNTHETIC",
  "owner_acceptance_ref": "owner-approval:studio-009p-03-contract",
  "provider_identity_evidence_ref": "evidence:nvidia-official-docs-2026-09-08",
  "transport_evidence_ref": "evidence:nvidia-nim-transport-policy",
  "credential_profile_ref": "credential-profile:nvidia-nim-api-key",
  "credential_evidence_ref": "evidence:credential-not-enrolled",
  "model_policy_evidence_ref": "evidence:nvidia-deepseek-v4-pro-0813-allowlist",
  "capability_evidence_ref": "evidence:nvidia-declared-capabilities",
  "data_export_evidence_ref": "evidence:nvidia-public-synthetic-trial-policy",
  "quota_evidence_ref": "evidence:nvidia-dynamic-trial-quota-policy",
  "budget_evidence_ref": "evidence:nvidia-zero-budget",
  "kill_switch_evidence_ref": "evidence:studio-owner-kill-switch",
  "incident_response_evidence_ref": "evidence:nvidia-nim-incident-response",
  "rollback_evidence_ref": "evidence:manual-fake-rollback",
  "accepted_at": "2026-09-08T10:09:56Z",
  "expires_at": "2027-09-08T10:09:56Z",
  "revoked_at": null,
  "as_of": "2026-09-08T10:10:00Z",
  "canonical_digest": "sha256:ccc97af2df709a67c03b5bdb0402f948c111c0ab6df7c86fcd56d4ca84d74bb2"
}
