{
  "schema_version": "1.0",
  "child_contract_id": "STUDIO-009P-02",
  "provider_profile_id": "provider-profile:cloudflare-workers-ai-free-nemotron-3-super",
  "provider_profile_digest": "sha256:c861aae85aed5600bdc7e33acb11c29958667a32dab487a4c095670a438cabf2",
  "evidence_class": "SYNTHETIC",
  "owner_acceptance_ref": "owner-approval:studio-009p-02-contract",
  "provider_identity_evidence_ref": "evidence:cloudflare-official-docs-2026-09-03",
  "transport_evidence_ref": "evidence:cloudflare-transport-policy",
  "credential_profile_ref": "credential-profile:cloudflare-workers-ai-api-token",
  "credential_evidence_ref": "evidence:credential-not-enrolled",
  "model_policy_evidence_ref": "evidence:cloudflare-nemotron-3-super-allowlist",
  "capability_evidence_ref": "evidence:cloudflare-declared-capabilities",
  "data_export_evidence_ref": "evidence:cloudflare-public-no-storage-policy",
  "quota_evidence_ref": "evidence:cloudflare-workers-free-quota-snapshot",
  "budget_evidence_ref": "evidence:cloudflare-zero-budget",
  "kill_switch_evidence_ref": "evidence:studio-owner-kill-switch",
  "incident_response_evidence_ref": "evidence:cloudflare-incident-response",
  "rollback_evidence_ref": "evidence:manual-fake-rollback",
  "accepted_at": "2026-09-03T16:51:18Z",
  "expires_at": "2027-09-03T16:51:18Z",
  "revoked_at": null,
  "as_of": "2026-09-03T16:52:00Z",
  "canonical_digest": "sha256:fcf2a068922d857a323ddcbaf849a89ccb58255b28777100fda2a0c5fee74b3f"
}
