{
  "schema_version": "1.0",
  "child_contract_id": "STUDIO-009P-SYNTHETIC",
  "provider_profile_id": "provider-profile:synthetic-alpha",
  "provider_profile_digest": "sha256:8fee3123fe96b192a035b878a64426a8ccbd281acec1ce8e35c07f493bf38367",
  "evidence_class": "SYNTHETIC",
  "owner_acceptance_ref": "owner-acceptance:studio-009p-synthetic",
  "provider_identity_evidence_ref": "evidence:provider-id-synthetic",
  "transport_evidence_ref": "evidence:transport-synthetic-none",
  "credential_profile_ref": "credential-profile:synthetic-provider",
  "credential_evidence_ref": "evidence:credential-synthetic-provider",
  "model_policy_evidence_ref": "evidence:model-policy-synthetic",
  "capability_evidence_ref": "evidence:capability-synthetic",
  "data_export_evidence_ref": "evidence:data-export-none",
  "quota_evidence_ref": "evidence:quota-zero",
  "budget_evidence_ref": "evidence:budget-zero",
  "kill_switch_evidence_ref": "evidence:kill-switch-synthetic",
  "incident_response_evidence_ref": "evidence:incident-synthetic",
  "rollback_evidence_ref": "evidence:rollback-manual-fake",
  "accepted_at": "2026-09-03T08:00:00Z",
  "expires_at": "2026-12-31T23:59:59Z",
  "revoked_at": null,
  "as_of": "2026-09-03T08:10:00Z",
  "canonical_digest": "sha256:7f02fd8ca6cd8637231b0c30a0d614f5e4c20a0cc8ce48f5a995ff53fe0e828a"
}
