{
  "schema_version": "1.0",
  "child_contract_id": "STUDIO-009P-04",
  "provider_profile_id": "provider-profile:poolside-direct-laguna-s-2.1",
  "provider_profile_digest": "sha256:2b10c6515c272c61a33193a2607cd198433fdaa8a5abd018ad2cc215e829a0ca",
  "evidence_class": "SYNTHETIC",
  "owner_acceptance_ref": "owner-approval:studio-009p-04-contract",
  "provider_identity_evidence_ref": "evidence:poolside-official-docs-2026-09-09",
  "transport_evidence_ref": "evidence:poolside-direct-transport-policy",
  "credential_profile_ref": "credential-profile:poolside-api-key",
  "credential_evidence_ref": "evidence:credential-not-enrolled",
  "model_policy_evidence_ref": "evidence:poolside-laguna-s-2.1-allowlist",
  "capability_evidence_ref": "evidence:poolside-declared-capabilities",
  "data_export_evidence_ref": "evidence:poolside-public-synthetic-training-risk",
  "quota_evidence_ref": "evidence:poolside-free-limited-dynamic-policy",
  "budget_evidence_ref": "evidence:poolside-zero-budget",
  "kill_switch_evidence_ref": "evidence:studio-owner-kill-switch",
  "incident_response_evidence_ref": "evidence:poolside-incident-response",
  "rollback_evidence_ref": "evidence:manual-fake-rollback",
  "accepted_at": "2026-09-09T05:32:06Z",
  "expires_at": "2027-09-09T05:32:06Z",
  "revoked_at": null,
  "as_of": "2026-09-09T05:32:10Z",
  "canonical_digest": "sha256:d1c3838be32a75edaed7e573b6027e2b92592f21ad63c7f842a45882dcffcfe2"
}
